{
  "schema_version": "shared-primitives/v1",
  "ids": {
    "workspace_id": "ws_foundation_001",
    "project_id": "project_foundation_001",
    "artifact_id": "artifact_foundation_001"
  },
  "timestamp": "2026-08-17T05:00:00.000Z",
  "media": { "start_sec": 0, "end_sec": 12.345, "duration_sec": 12.345 },
  "concurrency": { "revision": 7, "etag": "\"rev-7\"", "expected_version": 7 },
  "error": {
    "code": "dependency_unavailable",
    "category": "transient",
    "retryable": true,
    "safe_message": "A required dependency is temporarily unavailable."
  }
}
